{
  "price_usdc": 0.001,
  "version": 1,
  "request_schema": {
    "type": "object",
    "properties": {
      "text": {
        "type": "string",
        "description": "The text to summarize"
      }
    }
  },
  "response_schema": {
    "type": "object",
    "properties": {
      "summary": {
        "type": "string",
        "description": "The generated summary of the input text"
      }
    }
  }
}
